Section,Sous-section,Détails
Introduction,,"L'achat ou la location d'une voiture dépend du budget, de l'usage et des coûts d'entretien."
Achat,Avantages,"Liberté totale, coûts réduits à long terme, possibilité de revente."
Achat,Inconvénients,"Investissement initial élevé, dépréciation rapide, coûts d'entretien."
Achat,Neuf ou Occasion,Neuf : plus cher mais garantie. Occasion : moins cher mais vérifier l'historique.
Achat,Critères,"Budget, type de carburant, usage, espace et confort."
Location,Avantages,"Coût mensuel prévisible, accès à des véhicules récents, pas de souci de revente."
Location,Inconvénients,"Absence de propriété, restrictions d'utilisation, dépôt de garantie."
Location,Types,LOA : achat possible en fin de contrat. LLD : pas d'achat.
Conclusion,,"L'achat est préférable pour le long terme, la location pour changer régulièrement de voiture."
